<?xml version="1.0" encoding="UTF-8"?>
<!--
 Autor.- Susana Fabián Antón
 Fecha.- 11/02/2020
 Documento.- 05.xsd
-->
<xs:schema xmlns:xs="http://www.w3.org/2001/XMLSchema">
	<xs:element name="mundo">
		<xs:complexType>
			<xs:sequence>
				<xs:element name="continente" maxOccurs="unbounded">
					<xs:complexType>
						<xs:sequence>
							<xs:element name="nCont" type="xs:string"/>
							<xs:element name="pais" minOccurs="0" maxOccurs="unbounded">
								<xs:complexType>
									<xs:simpleContent>
										<xs:extension base="xs:string">
											<xs:attribute name="capital" type="xs:string"/>
										</xs:extension>
									</xs:simpleContent>
								</xs:complexType>
							</xs:element>
						</xs:sequence>
					</xs:complexType>
				</xs:element>
			</xs:sequence>
		</xs:complexType>
	</xs:element>
</xs:schema>