<?xml version="1.0" encoding="UTF-8" standalone="no"?>
<!--
 Autor.- Susana Fabián Antón
 Fecha.- 20/01/2020
 Documento.- 05.xml
-->
 

<mundo xmlns:xsi="http://www.w3.org/2001/XMLSchema-instance"
	xsi:noNamespaceSchemaLocation="schemas/05.xsd">
	<continente>
		<nCont>Europa</nCont>
		<pais capital="Berlin">Alemania</pais>
	</continente>
	<continente>
		<nCont>América</nCont>
		<pais capital="Buenos Aires">Argentina</pais>
		<pais capital="Nassau">Bahamas</pais>
	</continente>
	<continente>
		<nCont>Asia</nCont>
		<pais capital="Kabul">Afganistán</pais>
		<pais capital="Riad">Arabia Saudita</pais>
	</continente>
	<continente>
		<nCont>África</nCont>
	</continente>
</mundo>